{
  "run_id": "00000000-0000-0000-0000-000000000001",
  "row_hash": "eeeeeeeeeeeeeeeeeeeeeeeeeeeeeeeeeeeeeeeeeeeeeeeeeeeeeeeeeeeeeeee",
  "prev_hash": "0000000000000000000000000000000000000000000000000000000000000000",
  "entry_hash": "70822eff81f348766782e179fad858c5e55dd6cfb572a2e7497290053d49dd77"
}
